{"meta":{"run":"MR-CONV-2031","product":"MR conventional magnet line (1.5 tesla and 3 tesla scanners built around a helium-cooled superconducting magnet)","horizon":"2026 to 2031","read_date":"2026-10-11","next_read":"2027-01-11","tolerance_line":"An install more than 30 days late, or a line stop longer than 30 days, goes past the 30-day limit.","tolerance_tag":"Placeholder","confidence":"moderate","confidence_basis":"All 11 panel members agreed on both questions and on which site or supplier fails in each future. The dates after 2028 are votes on undated events, and the numbers that decide whether a failure is real (days of helium on hand, weeks of logic stock and the cold-head parent's share of revenue) are Placeholders that no owner has confirmed. Every internal value in this run is synthetic."},"risks":[{"rank":1,"node":"N16","name":"United States magnet plant","sentence":"One plant winds and tests every magnet for the Americas and Europe, and a storm, a strike or a grid curtailment stops it with nothing to cover.","threats":["natural disasters","labor","security","infrastructure"],"replace_months":36,"tag":"AI-suggested","confirm_by":"Site operations"},{"rank":2,"node":"N17","name":"China plant","sentence":"One plant builds every magnet and system for Asia inside a counterparty's borders, and a listing or a trade rupture strands it.","threats":["geopolitical","foreign trade and payments","natural disasters","security"],"replace_months":36,"tag":"AI-suggested","confirm_by":"Site operations"},{"rank":3,"node":"N18","name":"United States hub","sentence":"One site assembles every system for two regions, so any stop there delays every install at once.","threats":["natural disasters","labor","security","infrastructure"],"replace_months":36,"tag":"AI-suggested","confirm_by":"Site operations"},{"rank":4,"node":"N03","name":"Superconducting wire","sentence":"Every conventional magnet is wound from one mill's superconducting wire, and qualifying a second mill takes longer than the backlog covers.","threats":["geopolitical","foreign trade and payments","financial","security","labor"],"replace_months":18,"tag":"AI-suggested","confirm_by":"Engineering"},{"rank":5,"node":"N05","name":"Cold heads","sentence":"One maker in Japan supplies the cold heads that keep every magnet cold, and without one a magnet cannot ship or stay cold in the field.","threats":["natural disasters","geopolitical","financial","infrastructure"],"replace_months":18,"tag":"AI-suggested","confirm_by":"Engineering"},{"rank":6,"node":"N10","name":"Programmable logic","sentence":"The control electronics for every system use programmable logic that a foundry interruption or an entity listing can stop.","threats":["geopolitical","foreign trade and payments","natural disasters","security"],"replace_months":18,"tag":"AI-suggested","confirm_by":"Engineering"},{"rank":7,"node":"N20","name":"Technicians","sentence":"The winding and cryogenic trades at the United States plant live in one town, and a strike or a retirement cliff cuts output without any supplier failing.","threats":["labor","macroeconomic"],"replace_months":18,"tag":"AI-suggested","confirm_by":"Human resources"},{"rank":8,"node":"N19","name":"Helium cover","sentence":"Helium cover at the United States plant is shorter than the time to reroute a shipment, so any interruption to power, road or port reaches the line.","threats":["infrastructure","geopolitical","foreign trade and payments"],"replace_months":12,"tag":"Placeholder","confirm_by":"Site operations"}],"uncertainties":[{"id":"U1","question":"Will something outside the OEM stop a part or a shipping route for more than 30 days before 2031?","end_a":"No. Every measure costs money but stays inside the 30-day limit. Tariffs, payment friction and customs time raise the bill without stopping anything for more than 30 days.","end_b":"Yes. A producer country puts wire, niobium or cold heads under export control, an entity listing cuts the flow of parts through the China plant, or a sole supplier's owner leaves the MR business.","kind":"outcomes","moves_risks":["R2","R4","R5","R6","R3","R8"],"lean":-0.3,"lean_sentence":"The indicators lean weakly toward no. On 11 Oct 2026 the Section 232 investigation into medical products (a United States national-security trade investigation) had produced no proclamation, the trade truce with China was holding until its notice date, and no export-control listing named superconducting wire or cold heads.","settles_a":"The answer settles as no if the 2027 sourcing cycle closes with the China truce renewed, the Section 232 report limited to finished scanners, and no export-control listing of wire, niobium or cold heads.","settles_b":"The answer settles as yes if a notice in the Federal Register, from China's Ministry of Commerce or from a producer country names any of those parts, if an entity listing (the United States adding a company to its export blacklist) names the China plant or its logic supplier, or if a parent company announces the sale or closure of the wire mill or the cold-head plant.","reads":[{"date":"2026-10-11","lean":-0.3}]},{"id":"U2","question":"In 2031, will helium supply still decide whether a magnet ships?","end_a":"Yes. The Gulf route stays impaired or allocated, most new builds are still conventional, and a sealed magnet still needs a helium delivery for cool-down and testing.","end_b":"No. Helium returns to a buyers' market, or sealed magnets take most new builds with a small test draw, so the cold head becomes the part that keeps every magnet cold.","kind":"outcomes","moves_risks":["R1","R2","R8","R5","R7"],"lean":-0.6,"lean_sentence":"The indicators lean clearly toward yes. In the latest daily count, on 4 Oct 2026, four ships crossed the Gulf strait against a typical 85 (International Monetary Fund PortWatch data). Helium is bought on allocation letters, and no 3 tesla sealed magnet has been cleared for sale in the United States.","settles_a":"The answer settles as yes if a United States helium allocation or export rule is proposed, if repairs to Qatar's damaged helium plant slip past 2028, or if a sealed magnet's test draw is confirmed as the size of a full helium delivery.","settles_b":"The answer settles as no if the Gulf strait reopens to insured shipping and the allocation letters stop, if a 3 tesla sealed magnet is cleared, or if the test draw is confirmed as one gas cylinder rather than a full delivery.","reads":[{"date":"2026-10-11","lean":-0.6}]}],"futures":[{"id":"F1","name":"Trade costs rise and helium still limits shipments","position":{"u1":"a","u2":"a"},"leans_here":true,"sentence":"Trade rules raise costs but cut nothing off, and magnets still need helium to ship. Delivery dates depend on helium containers, the power grid and the roads rather than on trade rules.","what_happens":"The truce is renewed and no part is listed. The Gulf route stays near closed and both plants buy helium on allocation, the United States plant from domestic and Canadian sources and the China plant at the back of the Asian spot queue. Conventional builds still dominate because no 3 tesla sealed magnet is cleared. Both United States sites run winters under elevated grid ratings from 2027, and the helium cover thins each year because it is inventory bought at a 4 percent rate against rising prices.","path":[{"period":"2026 to 2028","sentence":"The truce is renewed at its notice date, the Gulf route stays near closed, and a container fleet with a 35 to 48 day hold sets the helium cover at the United States plant while the Carolinas grid is rated elevated from 2027."},{"period":"2028 to 2031","sentence":"Conventional builds still dominate, the Midcontinent grid is rated high from the winter of 2028, and the helium cover thins each budget round as rates and input prices stay up."}],"what_fails_first":{"node":"N19","sentence":"The United States magnet plant runs out of helium on hand first. A winter power curtailment or a flood cuts power to the liquefier and closes the trailer road while the next helium container is still in transit, and the helium on hand runs out before the delivery arrives.","tag":"Placeholder on the days of cover; Panel judgement on the path"},"how_soon":"The failure comes in the winter of 2028 to 2029. A storm as severe as the 2018 inland flood could bring it forward to any hurricane season from 2027. The China plant's helium allocation queue is the second to fail, pushing Asian installs more than 30 days late in the first half of 2028.","what_it_costs":"The United States magnet plant stops once for 30 to 45 days, and a quarter of Western Hemisphere installs run more than 30 days late (panel estimate). Asian installs run late on the allocation schedule. Market share does not move, because every supplier is short of helium at the same time.","what_prevents_it":"Logistics keeps more days of helium on hand at the United States plant than a container's hold time plus the 10 days the grid took to rebuild after the 2024 storm. Site operations puts the liquefier on backup power separate from the plant's power feed. Both must be in place before the winter of 2028, so both start by the second quarter of 2027.","how_sure":{"level":"low","basis":"the fleet of helium containers, the hold time, the grid ratings and the allocation letters come from dated public sources, but no grid warning has yet led to a curtailment lasting weeks, the days of helium on hand are a Placeholder, and the panel split six to five on which plant fails first."},"what_would_change_this":"A 3 tesla sealed magnet cleared for sale, or the Gulf route reopening, moves the line toward Future 2. A United States helium allocation rule moves it toward Future 3. A confirmed figure of more than 60 days of helium on hand at the United States plant removes that failure, and the China plant's helium queue becomes the first to fail."},{"id":"F2","name":"Trade costs rise and sealed magnets end the helium limit","position":{"u1":"a","u